"0925-9635","ENGENHARIAS IV                                    ","Diamond and Related Materials","A1",2008
"0971-3514","ENGENHARIAS IV                                    ","Differential Equations and Dynamical Systems","B4",2008
"1012-0394","ENGENHARIAS IV                                    ","Diffusion and Defect Data, Solid State Data. Part B, Solid State Phenomena","B5",2008
"0163-2116","ENGENHARIAS IV                                    ","Digestive Diseases and Sciences","B2",2008
"1051-2004","ENGENHARIAS IV                                    ","Digital Signal Processing (Print)","A1",2008
"0166-218X","ENGENHARIAS IV                                    ","Discrete Applied Mathematics","B1",2008
"0924-6703","ENGENHARIAS IV                                    ","Discrete Event Dynamic Systems","A2",2008
"0143-7208","ENGENHARIAS IV                                    ","Dyes and Pigments","A2",2008
"1808-2599","ENGENHARIAS IV                                    ","E-Compós (Brasília)","B5",2008
"1682-1130","ENGENHARIAS IV                                    ","E-journal - CIGR","B5",2008
"0167-9295","ENGENHARIAS IV                                    ","Earth, Moon, and Planets","B2",2008
"1574-9541","ENGENHARIAS IV                                    ","Ecological Informatics (Print)","B2",2008
"0304-3800","ENGENHARIAS IV                                    ","Ecological Modelling","B1",2008
"0912-3814","ENGENHARIAS IV                                    ","Ecological Research","B2",2008
"0266-4666","ENGENHARIAS IV                                    ","Econometric Theory (Print)","A2",2008
"1938-5862","ENGENHARIAS IV                                    ","ECS Transactions","B5",2008
"1938-6737","ENGENHARIAS IV                                    ","ECS Transactions (Online)","B5",2008
"1685-9545","ENGENHARIAS IV                                    ","ECTI Transactions on Electrical Eng. / Electronics and Communications","B5",2008
"1414-5057","ENGENHARIAS IV                                    ","Educação & Tecnologia","B5",2008
"1678-0701","ENGENHARIAS IV                                    ","Educação Ambiental em Ação","B5",2008
"1360-2357","ENGENHARIAS IV                                    ","Education and Information Technologies","B5",2008
"0731-356X","ENGENHARIAS IV                                    ","Electric Machines and Power Systems (Cessou em 2000. Cont. ISSN 1532-5008 Electric Power Components and Systems)","B1",2008
"1532-5008","ENGENHARIAS IV                                    ","Electric Power Components and Systems","B1",2008
"0378-7796","ENGENHARIAS IV                                    ","Electric Power Systems Research (Print)","A2",2008
"0948-7921","ENGENHARIAS IV                                    ","Electrical Engineering (Berlin. Print)","B1",2008
"1099-0062","ENGENHARIAS IV                                    ","Electrochemical and Solid-State Letters","B1",2008
"1223-057X","ENGENHARIAS IV                                    ","Electromotion (Cluj-Napoca)","B5",2008
"0301-150X","ENGENHARIAS IV                                    ","Electromyography and Clinical Neurophysiology","B3",2008
"1571-0661","ENGENHARIAS IV                                    ","Electronic Notes in Theoretical Computer Science","B4",2008
"0013-5194","ENGENHARIAS IV                                    ","Electronics Letters","A1",2008
"0100-2104","ENGENHARIAS IV                                    ","Eletricidade Moderna","B5",2008
"1806-1877","ENGENHARIAS IV                                    ","Eletroevolução (Rio de Janeiro)","B3",2008
"1414-8862","ENGENHARIAS IV                                    ","Eletrônica de Potência (Impresso)","B1",2008
"0922-3444","ENGENHARIAS IV                                    ","Elsevier (Amsterdam)","B3",2008
"1382-3256","ENGENHARIAS IV                                    ","Empirical Software Engineering","B1",2008
"1062-3329","ENGENHARIAS IV                                    ","Endothelium (Philadelphia. Print)","B1",2008
"0196-8904","ENGENHARIAS IV                                    ","Energy Conversion and Management","B1",2008
"1570-646X","ENGENHARIAS IV                                    ","Energy Efficiency","B3",2008
"0301-4215","ENGENHARIAS IV                                    ","Energy Policy","B1",2008
"0100-6916","ENGENHARIAS IV                                    ","Engenharia Agrícola (Impresso)","B3",2008
"1414-3984","ENGENHARIAS IV                                    ","Engenharia na Agricultura","B5",2008
"1415-7314","ENGENHARIAS IV                                    ","Engevista (UFF)","B5",2008
"0955-7997","ENGENHARIAS IV                                    ","Engineering Analysis with Boundary Elements","B1",2008
"0952-1976","ENGENHARIAS IV                                    ","Engineering Applications of Artificial Intelligence","A1",2008
"0104-4036","ENGENHARIAS IV                                    ","Ensaio (Fundação Cesgranrio. Impresso)","B4",2008
"0160-4120","ENGENHARIAS IV                                    ","Environment International","A2",2008
"1811-0231","ENGENHARIAS IV                                    ","Environmental Informatics Archives (Online)","B5",2008
"1180-4009","ENGENHARIAS IV                                    ","EnvironMetrics (London. Ont.)","B2",2008
"0013-9580","ENGENHARIAS IV                                    ","Epilepsia (Copenhagen)","B1",2008
"1525-5050","ENGENHARIAS IV                                    ","Epilepsy & Behavior (Print)","B1",2008
"0920-1211","ENGENHARIAS IV                                    ","Epilepsy Research","B1",2008
"1807-8575","ENGENHARIAS IV                                    ","Espaço Energia","B5",2008
"0103-0876","ENGENHARIAS IV                                    ","Estudos (UCGO. Impresso)","B5",2008
"1808-7310","ENGENHARIAS IV                                    ","Estudos Tecnológicos (Online)","B5",2008
"0014-1755","ENGENHARIAS IV                                    ","Ethiopian Medical Journal","B5",2008
"1687-6172","ENGENHARIAS IV                                    ","EURASIP Journal on Advances in Signal Processing (Print)","A2",2008
"1110-8657","ENGENHARIAS IV                                    ","EURASIP Journal on Applied Signal Processing (Cessou em 2006. Cont. ISSN 1687-6172 EURASIP Journal on Advances in Signal Processing (Print))","A2",2008
"0941-0635","ENGENHARIAS IV                                    ","EURASIP Journal on Applied Signal Processing. (Cessou em 2006. Cont.1687-6172 EURASIP Journal on Advances in Signal Processing)","B3",2008
"1687-4714","ENGENHARIAS IV                                    ","EURASIP Journal on Audio, Speech and Music Processing (Print)","B3",2008
"1687-4161","ENGENHARIAS IV                                    ","EURASIP Journal on Multimedia and Information Security (Print)","B3",2008
"1687-1472","ENGENHARIAS IV                                    ","EURASIP Journal on Wireless Communications and Networking","B3",2008
"0014-2956","ENGENHARIAS IV                                    ","European Journal of Biochemistry (Print) (Cessou em 2004. Cont. ISSN 1742-464X The FEBS Journal (Print))","B3",2008
"0947-3580","ENGENHARIAS IV                                    ","European Journal of Control","A2",2008
"1351-847X","ENGENHARIAS IV                                    ","European Journal of Finance (Print)","B5",2008
"0377-2217","ENGENHARIAS IV                                    ","European Journal of Operational Research","A1",2008
"0014-3057","ENGENHARIAS IV                                    ","European Polymer Journal","B1",2008
"1430-144X","ENGENHARIAS IV                                    ","European Transactions on Electrical Power","B1",2008
"1124-318X","ENGENHARIAS IV                                    ","European Transactions on Telecommunications","A2",2008
"1063-6560","ENGENHARIAS IV                                    ","Evolutionary Computation","A2",2008
"0014-4819","ENGENHARIAS IV                                    ","Experimental Brain Research","B2",2008
"0301-472X","ENGENHARIAS IV                                    ","Experimental Hematology","B1",2008
"0014-4886","ENGENHARIAS IV                                    ","Experimental Neurology","B1",2008
"0972-0871","ENGENHARIAS IV                                    ","Far East Journal of Mathematical Sciences: FJMS","B4",2008
"1980-8526","ENGENHARIAS IV                                    ","Fatecnológica (FATEC-JAHU)","B5",2008
"0015-0193","ENGENHARIAS IV                                    ","Ferroelectrics (Print)","B2",2008
"0146-8030","ENGENHARIAS IV                                    ","Fiber and Integrated Optics (Print)","A2",2008
"1518-9740","ENGENHARIAS IV                                    ","Fisioterapia Brasil","B4",2008
"0103-5150","ENGENHARIAS IV                                    ","Fisioterapia em Movimento (PUCPR. Impresso)","B4",2008
"1519-9088","ENGENHARIAS IV                                    ","Fitness & Performance Journal (Impresso)","B4",2008
"0955-5986","ENGENHARIAS IV                                    ","Flow Measurement and Instrumentation","A2",2008
"1668-9402","ENGENHARIAS IV                                    ","Fonoaudiológica (Buenos Aires)","B4",2008
"0308-8146","ENGENHARIAS IV                                    ","Food Chemistry","A2",2008
"0963-9969","ENGENHARIAS IV                                    ","Food Research International","B1",2008
"0934-5043","ENGENHARIAS IV                                    ","Formal Aspects of Computing","B1",2008
"0922-6389","ENGENHARIAS IV                                    ","Frontiers in Artificial Intelligence and Applications","B5",2008
"0016-2361","ENGENHARIAS IV                                    ","Fuel (Guildford)","A2",2008
"0169-2968","ENGENHARIAS IV                                    ","Fundamenta Informaticae","B2",2008
"0167-739X","ENGENHARIAS IV                                    ","Future Generation Computer Systems","B1",2008
"0165-0114","ENGENHARIAS IV                                    ","Fuzzy Sets and Systems","A1",2008
"0966-6362","ENGENHARIAS IV                                    ","Gait & Posture (Oxford)","A2",2008
"1389-2576","ENGENHARIAS IV                                    ","Genetic Programming and Evolvable Machines (Print)","B5",2008
"1415-4757","ENGENHARIAS IV                                    ","Genetics and Molecular Biology (Impresso)","B2",2008
"1676-5680","ENGENHARIAS IV                                    ","Genetics and Molecular Research","B2",2008
"1573-7624","ENGENHARIAS IV                                    ","Geoinformatica (Dordrecht. Online)","B1",2008
"0094-8276","ENGENHARIAS IV                                    ","Geophysical Research Letters","B1",2008
"1984-2430","ENGENHARIAS IV                                    ","GEPROS. Gestão da Produção, Operações e Sistemas (Online)","B4",2008
"0104-530X","ENGENHARIAS IV                                    ","Gestão & Produção (UFSCAR. Impresso)","B4",2008
"1738-9682","ENGENHARIAS IV                                    ","GESTS International Transaction on Communication and Signal Processing","B5",2008
"0017-0895","ENGENHARIAS IV                                    ","Glasgow Mathematical Journal (Print)","B2",2008
"0103-1155","ENGENHARIAS IV                                    ","Hífen (PUCRS. Impresso)","B5",2008
"1809-4260","ENGENHARIAS IV                                    ","Hipertensão (São Paulo. Impresso)","B5",2008
"0309-0167","ENGENHARIAS IV                                    ","Histopathology (Oxford. Print)","B1",2008
"1518-1634","ENGENHARIAS IV                                    ","Holos (Natal. Impresso)","B4",2008
"0287-8658","ENGENHARIAS IV                                    ","Hoso Gijutsu (Tokyo. 1948)","B4",2008
"1065-9471","ENGENHARIAS IV                                    ","Human Brain Mapping (Print)","B1",2008
"0815-3817","ENGENHARIAS IV                                    ","Hypertension (Woden)","A2",2008
"0018-9340","ENGENHARIAS IV                                    ","I.E.E.E. Transactions on Computers (Print)","A1",2008
"0018-9383","ENGENHARIAS IV                                    ","I.E.E.E. Transactions on Electron Devices","A1",2008
"0019-8145","ENGENHARIAS IV                                    ","IDR. Industrial Diamond Review","B5",2008
"1350-2409","ENGENHARIAS IV                                    ","IEE Proceedings. Circuits, Devices and Systems (Cessou em 2006. Cont. ISSN 1751-858X IET Circuits, Devices & Systems (Print))","A2",2008
"1350-2425","ENGENHARIAS IV                                    ","IEE Proceedings. Communications (Cessou em 2006. Cont. ISSN 1751-8628 IET Communications (Print))","A2",2008
"1350-2387","ENGENHARIAS IV                                    ","IEE Proceedings. Computers and Digital Techniques (Cessou em 2006. Cont. ISSN 1751-8601 IET Computers & Digital Techniques (Print))","B1",2008
"1350-2379","ENGENHARIAS IV                                    ","IEE Proceedings. Control Theory and Applications","A1",2008
"1350-2352","ENGENHARIAS IV                                    ","IEE Proceedings. Electric Power Applications (Cessou em 2006. Cont. ISSN 1751-8660 IET Electric Power Applications (Print))","A1",2008
"1350-2360","ENGENHARIAS IV                                    ","IEE Proceedings. Generation, Transmission & Distribution (Cessou em 2006. Cont. ISSN 1751-8687 IET Generation, Transmission & Distribution (Print))","A2",2008
"1747-0722","ENGENHARIAS IV                                    ","IEE Proceedings. Information Security (Print) (Cessou em 2006. Cont. ISSN 1751-8709 IET Information Security (Print))","B1",2008
"1350-2417","ENGENHARIAS IV                                    ","IEE Proceedings. Microwaves, Antennas and Propagation (Cessou em 2006. Cont. ISSN 1751-8725 IET Microwaves, Antennas & Propagation (Print))","A2",2008
"1350-2433","ENGENHARIAS IV                                    ","IEE Proceedings. Optoelectronics (Cessou em 2006. Cont. ISSN 1751-8768 IET Optoelectronics (Print))","B1",2008
"1350-2344","ENGENHARIAS IV                                    ","IEE Proceedings. Science, Measurement and Technology (Cessou em 2006. Cont. ISSN 1751-8822 IET Science, Measurement & Technology (Print))","A2",2008
"1350-245X","ENGENHARIAS IV                                    ","IEE Proceedings. Vision, Image and Signal Processing (Cessou em 2006. Foi desdobrado em três: ISSN 1751-9632 IET Computer Vision (Print), ISSN 1751-9659 IET Image Processing (Print) e ISSN 1751-9675 IET Signal Processing (Print))","A2",2008
"0885-8985","ENGENHARIAS IV                                    ","IEEE Aerospace and Electronic Systems Magazine","B1",2008
"1045-9243","ENGENHARIAS IV                                    ","IEEE Antennas & Propagation Magazine","A1",2008
"1536-1225","ENGENHARIAS IV                                    ","IEEE Antennas and Wireless Propagation Letters","A1",2008
"8755-3996","ENGENHARIAS IV                                    ","IEEE Circuits and Devices Magazine (Cessou em 1990. Cont. IEEE Circuits & Devices)","A1",2008
"1089-7798","ENGENHARIAS IV                                    ","IEEE Communications Letters (Print)","A1",2008
"0163-6804","ENGENHARIAS IV                                    ","IEEE Communications Magazine (Print)","A1",2008
"0740-7475","ENGENHARIAS IV                                    ","IEEE Design & Test of Computers (Print)","A1",2008
"0739-5175","ENGENHARIAS IV                                    ","IEEE Engineering in Medicine and Biology Magazine","A1",2008
"1545-598X","ENGENHARIAS IV                                    ","IEEE Geoscience and Remote Sensing Letters (Print)","A1",2008
"1077-2618","ENGENHARIAS IV                                    ","IEEE Industry Applications Magazine (Print)","A2",2008
"0018-9197","ENGENHARIAS IV                                    ","IEEE Journal of Quantum Electronics","A1",2008
"0733-8716","ENGENHARIAS IV                                    ","IEEE Journal on Selected Areas in Communications (Print)","A1",2008
"1051-8207","ENGENHARIAS IV                                    ","IEEE Microwave and Guided Wave Letters","B3",2008
"1531-1309","ENGENHARIAS IV                                    ","IEEE Microwave and Wireless Components Letters","A1",2008
"1558-7908","ENGENHARIAS IV                                    ","IEEE Multidisciplinary Engineering Education Magazine","B3",2008
"1070-986X","ENGENHARIAS IV                                    ","IEEE Multimedia","A1",2008
"0890-8044","ENGENHARIAS IV                                    ","IEEE Network","A1",2008
"1041-1135","ENGENHARIAS IV                                    ","IEEE Photonics Technology Letters","A1",2008
"0278-6648","ENGENHARIAS IV                                    ","IEEE Potentials","B3",2008
"1540-7977","ENGENHARIAS IV                                    ","IEEE Power & Energy Magazine","B3",2008
"0272-1724","ENGENHARIAS IV                                    ","IEEE Power Engineering Review (Cessou em 2002. Fundiu-se com ISSN 0895-0156 IEEE Computer Applications in Power e ISSN 1540-7977 IEEE Power & Energy Magazin)","B3",2008
"1530-437X","ENGENHARIAS IV                                    ","IEEE Sensors Journal","A1",2008
"1070-9908","ENGENHARIAS IV                                    ","IEEE Signal Processing Letters","A1",2008
"1053-5888","ENGENHARIAS IV                                    ","IEEE Signal Processing Magazine (Print)","A1",2008
"0018-9251","ENGENHARIAS IV                                    ","IEEE Transactions on Aerospace and Electronic Systems","A2",2008
"0018-926X","ENGENHARIAS IV                                    ","IEEE Transactions on Antennas and Propagation (Print)","A1",2008
"1051-8223","ENGENHARIAS IV                                    ","IEEE Transactions on Applied Superconductivity (Print)","A2",2008
"1558-7916","ENGENHARIAS IV                                    ","IEEE Transactions on Audio, Speech, and Language Processing","A1",2008
"0018-9286","ENGENHARIAS IV                                    ","IEEE Transactions on Automatic Control (Print)","A1",2008
"0018-9294","ENGENHARIAS IV                                    ","IEEE Transactions on Biomedical Engineering (Print)","A1",2008
"0018-9316","ENGENHARIAS IV                                    ","IEEE Transactions on Broadcasting","A1",2008
"1051-8215","ENGENHARIAS IV                                    ","IEEE Transactions on Circuits and Systems for Video Technology (Print)","A1",2008
"1057-7122","ENGENHARIAS IV                                    ","IEEE Transactions on Circuits and Systems. I, Fundamental Theory and Applications (Cessou em 2003. Cont.1549-8328 IEEE Transactions on Circuits and Systems. I, Regular Papers)","A1",2008
"1558-0806","ENGENHARIAS IV                                    ","IEEE Transactions on Circuits and Systems. I, Regular Papers (Online)","A1",2008
"1549-8328","ENGENHARIAS IV                                    ","IEEE Transactions on Circuits and Systems. I, Regular Papers (Print)","A1",2008
"1057-7130","ENGENHARIAS IV                                    ","IEEE Transactions on Circuits and Systems. II, Analog and Digital Signal Processing (Cessou em 2002. Funfiu-se com ISSN 1057-7122 e 1549-8328)","A2",2008
"0090-6778","ENGENHARIAS IV                                    ","IEEE Transactions on Communications (Print)","A1",2008
"0278-0070","ENGENHARIAS IV                                    ","IEEE Transactions on Computer-Aided Design of Integrated Circuits and Systems","A1",2008
"1063-6536","ENGENHARIAS IV                                    ","IEEE Transactions on Control Systems Technology (Print)","A1",2008
"1070-9878","ENGENHARIAS IV                                    ","IEEE Transactions on Dielectrics and Electrical Insulation","A2",2008
"0018-9359","ENGENHARIAS IV                                    ","IEEE Transactions on Education","A1",2008
"0018-9375","ENGENHARIAS IV                                    ","IEEE Transactions on Electromagnetic Compatibility (Print)","A2",2008
"0885-8969","ENGENHARIAS IV                                    ","IEEE Transactions on Energy Conversion","A1",2008
"1089-778X","ENGENHARIAS IV                                    ","IEEE Transactions on Evolutionary Computation","A1",2008
"1063-6706","ENGENHARIAS IV                                    ","IEEE Transactions on Fuzzy Systems","A1",2008
"1057-7149","ENGENHARIAS IV                                    ","IEEE Transactions on Image Processing","A1",2008
"0278-0046","ENGENHARIAS IV                                    ","IEEE Transactions on Industrial Electronics (1982. Print)","A1",2008
"1551-3203","ENGENHARIAS IV                                    ","IEEE Transactions on Industrial Informatics","A1",2008
"0093-9994","ENGENHARIAS IV                                    ","IEEE Transactions on Industry Applications","A1",2008
"1089-7771","ENGENHARIAS IV                                    ","IEEE Transactions on Information Technology in Biomedicine","A1",2008
"0018-9448","ENGENHARIAS IV                                    ","IEEE Transactions on Information Theory","A1",2008
"0018-9456","ENGENHARIAS IV                                    ","IEEE Transactions on Instrumentation and Measurement","A2",2008
"0018-9464","ENGENHARIAS IV                                    ","IEEE Transactions on Magnetics","A1",2008
"0278-0062","ENGENHARIAS IV                                    ","IEEE Transactions on Medical Imaging (Print)","A1",2008
"0018-9480","ENGENHARIAS IV                                    ","IEEE Transactions on Microwave Theory and Techniques","A1",2008
"1520-9210","ENGENHARIAS IV                                    ","IEEE Transactions on Multimedia","A1",2008
"1045-9227","ENGENHARIAS IV                                    ","IEEE Transactions on Neural Networks","A1",2008
"1534-4320","ENGENHARIAS IV                                    ","IEEE Transactions on Neural Systems and Rehabilitation Engineering","A1",2008
"0018-9499","ENGENHARIAS IV                                    ","IEEE Transactions on Nuclear Science","A1",2008
"1045-9219","ENGENHARIAS IV                                    ","IEEE Transactions on Parallel and Distributed Systems (Print)","A1",2008
"0162-8828","ENGENHARIAS IV                                    ","IEEE Transactions on Pattern Analysis and Machine Intelligence","A1",2008
"0885-8977","ENGENHARIAS IV                                    ","IEEE Transactions on Power Delivery","A1",2008
"0885-8993","ENGENHARIAS IV                                    ","IEEE Transactions on Power Electronics","A1",2008
"0885-8950","ENGENHARIAS IV                                    ","IEEE Transactions on Power Systems","A1",2008
"1053-587X","ENGENHARIAS IV                                    ","IEEE Transactions on Signal Processing","A1",2008
"1063-6676","ENGENHARIAS IV                                    ","IEEE Transactions on Speech and Audio Processing (Cessou em 2005. Cont. ISSN 1558-7916 IEEE Transactions on Audio, Speech, and Language Processing)","A1",2008
"1083-4427","ENGENHARIAS IV                                    ","IEEE Transactions on Systems, Man and Cybernetics. Part A. Systems and Humans","A1",2008
"1083-4419","ENGENHARIAS IV                                    ","IEEE Transactions on Systems, Man and Cybernetics. Part B. Cybernetics","A1",2008
"1094-6977","ENGENHARIAS IV                                    ","IEEE Transactions on Systems, Man and Cybernetics. Part C, Applications and Reviews","A1",2008
"0885-3010","ENGENHARIAS IV                                    ","IEEE Transactions on Ultrasonics, Ferroelectrics, and Frequency Control","A1",2008
"0018-9545","ENGENHARIAS IV                                    ","IEEE Transactions on Vehicular Technology","A1",2008
"1063-8210","ENGENHARIAS IV                                    ","IEEE Transactions on Very Large Scale Integration (VLSI) Systems (Print)","A1",2008
"1536-1276","ENGENHARIAS IV                                    ","IEEE Transactions on Wireless Communications","A1",2008
"1536-1284","ENGENHARIAS IV                                    ","IEEE Wireless Communications","A1",2008
"1063-6692","ENGENHARIAS IV                                    ","IEEE/ACM Transactions on Networking (Print)","A1",2008
"0916-8524","ENGENHARIAS IV                                    ","IEICE Transactions on Electronics","A2",2008
"0916-8508","ENGENHARIAS IV                                    ","IEICE Transactions on Fundamentals of Electronics, Communications and Computer Science","A2",2008
"0916-8532","ENGENHARIAS IV                                    ","IEICE Transactions on Information and Systems","B1",2008
"1751-858X","ENGENHARIAS IV                                    ","IET Circuits, Devices & Systems (Print)","A2",2008
"1751-8628","ENGENHARIAS IV                                    ","IET Communications (Print)","B1",2008
"1751-8644","ENGENHARIAS IV                                    ","IET Control Theory & Applications (Print)","A2",2008
"1751-644","ENGENHARIAS IV                                    ","IET Control Theory and Applications","B1",2008
"1751-8695","ENGENHARIAS IV                                    ","IET Generation, Transmission & Distribution (Online)","A2",2008
"1751-8687","ENGENHARIAS IV                                    ","IET Generation, Transmission & Distribution (Print)","A2",2008
"1751-8725","ENGENHARIAS IV                                    ","IET Microwaves, Antennas & Propagation (Print)","A2",2008
"1752-1424","ENGENHARIAS IV                                    ","IET Renewable Power Generation (Online)","B3",2008
"1752-1416","ENGENHARIAS IV                                    ","IET Renewable Power Generation (Print)","B3",2008
"1751-8830","ENGENHARIAS IV                                    ","IET Science, Measurement & Technology (Online)","B1",2008
