"1414-3674","ENGENHARIAS IV                                    ","Ortodontia Gaúcha","B5",2008
"0937-941X","ENGENHARIAS IV                                    ","Osteoporosis International","B1",2008
"1348-9151","ENGENHARIAS IV                                    ","Pacific Journal of Optimization (Print)","B4",2008
"0167-8191","ENGENHARIAS IV                                    ","Parallel Computing","B1",2008
"0932-0113","ENGENHARIAS IV                                    ","Parasitology Research (1987. Print)","B2",2008
"0344-0338","ENGENHARIAS IV                                    ","Pathology, Research and Practice (Print)","B2",2008
"1433-7541","ENGENHARIAS IV                                    ","Pattern Analysis and Applications (Print)","B1",2008
"0031-3203","ENGENHARIAS IV                                    ","Pattern Recognition","A1",2008
"0167-8655","ENGENHARIAS IV                                    ","Pattern Recognition Letters","B1",2008
"1463-9076","ENGENHARIAS IV                                    ","PCCP. Physical Chemistry Chemical Physics (Print)","B1",2008
"0031-5125","ENGENHARIAS IV                                    ","Perceptual and Motor Skills","B2",2008
"0166-5316","ENGENHARIAS IV                                    ","Performance Evaluation","B1",2008
"0100-204X","ENGENHARIAS IV                                    ","Pesquisa Agropecuária Brasileira (1977. Impressa)","B1",2008
"1414-8595","ENGENHARIAS IV                                    ","Pesquisa Naval (SDM)","B5",2008
"0101-7438","ENGENHARIAS IV                                    ","Pesquisa Operacional (Impresso)","B4",2008
"0101-5397","ENGENHARIAS IV                                    ","Petro & Química","B5",2008
"0031-6768","ENGENHARIAS IV                                    ","Pfluegers Archiv","B1",2008
"1478-6435","ENGENHARIAS IV                                    ","Philosophical Magazine (2003. Print)","A2",2008
"1364-503X","ENGENHARIAS IV                                    ","Philosophical Transactions - Royal Society. Mathematical, Physical and Engineering Sciences (Print)","A2",2008
"0080-4614","ENGENHARIAS IV                                    ","Philosophical Transactions of the Royal Society of London, Series A: Mathematical and Physical Sciences","B3",2008
"1474-905X","ENGENHARIAS IV                                    ","Photochemical & Photobiological Sciences (Print)","B2",2008
"0031-8655","ENGENHARIAS IV                                    ","Photochemistry and Photobiology","B2",2008
"1549-5418","ENGENHARIAS IV                                    ","Photomedicine and Laser Surgery","B1",2008
"1387-974X","ENGENHARIAS IV                                    ","Photonic Network Communications","A2",2008
"0031-8965","ENGENHARIAS IV                                    ","Physica Status Solidi. A, Applied Research (Cessou em 2004. Cont. ISSN 1862-6300 Physica Status Solidi. A, Applications and Materials Science (Print))","B1",2008
"0370-1972","ENGENHARIAS IV                                    ","Physica Status Solidi. B, Basic Research","B2",2008
"1610-1634","ENGENHARIAS IV                                    ","Physica Status Solidi. C, Conferences and Critical Reviews (Cessou em 2005. Cont. ISSN 1862-6351 Physica Status Solidi. C, Current Topics in Solid State Physics (Print))","B3",2008
"0378-4371","ENGENHARIAS IV                                    ","Physica. A (Print)","B1",2008
"0921-4526","ENGENHARIAS IV                                    ","Physica. B, Condensed Matter (Print)","B2",2008
"0921-4534","ENGENHARIAS IV                                    ","Physica. C, Superconductivity (Print)","B2",2008
"0167-2789","ENGENHARIAS IV                                    ","Physica. D, Nonlinear phenomena (Print)","B1",2008
"1386-9477","ENGENHARIAS IV                                    ","Physica. E, Low-Dimensional Systems and Nanostructures (Print)","B2",2008
"1478-3967","ENGENHARIAS IV                                    ","Physical Biology (Print)","B1",2008
"1063-651X","ENGENHARIAS IV                                    ","Physical Review E. (Cessou em 2000. Cont. 1539-3755 Physical Review. E, Statistical, Nonlinear, and Soft Matter Physics)","B1",2008
"0031-9007","ENGENHARIAS IV                                    ","Physical Review Letters (Print)","A2",2008
"1098-0121","ENGENHARIAS IV                                    ","Physical Review. B, Condensed Matter and Materials Physics","A2",2008
"0163-1829","ENGENHARIAS IV                                    ","Physical Review. B, Condensed Matter. (Cessou 1997. Cont. 1098-0121 Physical Review. B, Condensed Matter and Materials Physics)","A1",2008
"0556-2805","ENGENHARIAS IV                                    ","Physical Review. B. Solid State. (Cessou em 1978. Cont. 1098-0121 Physical Review. B, Condensed Matter and Materials Physics)","A2",2008
"1095-3787","ENGENHARIAS IV                                    ","Physical Review. E, Statistical Physics, Plasmas, Fluids, and Related Interdisciplinary Topics (Online) (Cessou em 2000. Cont. ISSN 1550-2376 Physical Review. E, Statistical, Nonlinear and Soft Matter Physics (Online))","B2",2008
"1539-3755","ENGENHARIAS IV                                    ","Physical Review. E, Statistical, Nonlinear, and Soft Matter Physics (Print)","B1",2008
"0031-9120","ENGENHARIAS IV                                    ","Physics Education (Bristol. Print)","B3",2008
"0031-9155","ENGENHARIAS IV                                    ","Physics in Medicine and Biology (Print)","A1",2008
"0375-9601","ENGENHARIAS IV                                    ","Physics Letters. A (Print)","B1",2008
"0370-2693","ENGENHARIAS IV                                    ","Physics Letters. B (Print)","A2",2008
"1063-7788","ENGENHARIAS IV                                    ","Physics of Atomic Nuclei (Print)","B2",2008
"1070-664X","ENGENHARIAS IV                                    ","Physics of Plasmas","B1",2008
"0967-3334","ENGENHARIAS IV                                    ","Physiological Measurement (Print)","A2",2008
"0031-9384","ENGENHARIAS IV                                    ","Physiology & Behavior","B1",2008
"1435-8603","ENGENHARIAS IV                                    ","Plant Biology (Stuttgart)","B1",2008
"0167-4412","ENGENHARIAS IV                                    ","Plant Molecular Biology","B1",2008
"0168-9452","ENGENHARIAS IV                                    ","Plant Science (Limerick)","B2",2008
"0100-8358","ENGENHARIAS IV                                    ","Planta Daninha (Impresso)","B3",2008
"0741-3335","ENGENHARIAS IV                                    ","Plasma Physics and Controlled Fusion (Print)","B1",2008
"1612-8850","ENGENHARIAS IV                                    ","Plasma Processes and Polymers (Print)","B1",2008
"1084-0184","ENGENHARIAS IV                                    ","Plasmas and Polymers (Cessou em 2004)","B3",2008
"0104-1428","ENGENHARIAS IV                                    ","Polímeros (São Carlos. Impresso)","B4",2008
"0032-3861","ENGENHARIAS IV                                    ","Polymer (Guildford)","A2",2008
"0170-0839","ENGENHARIAS IV                                    ","Polymer Bulletin (Berlin. Print)","B1",2008
"0959-8103","ENGENHARIAS IV                                    ","Polymer International","B1",2008
"0934-7348","ENGENHARIAS IV                                    ","Powder Handling & Processing","B5",2008
"1054-7460","ENGENHARIAS IV                                    ","Presence (Cambridge, Mass.)","B2",2008
"1517-0306","ENGENHARIAS IV                                    ","Principia (João Pessoa)","B5",2008
"0962-8452","ENGENHARIAS IV                                    ","Proceedings - Royal Society. Biological Sciences (Print)","B1",2008
"0002-9939","ENGENHARIAS IV                                    ","Proceedings of the American Mathematical Society","B2",2008
"0018-9219","ENGENHARIAS IV                                    ","Proceedings of the IEEE","A1",2008
"0954-4054","ENGENHARIAS IV                                    ","Proceedings of the Institution of Mechanical Engineers. Part B, Journal of Engineering Manufacture","B1",2008
"0103-6513","ENGENHARIAS IV                                    ","Produção (São Paulo. Impresso)","B5",2008
"1062-7995","ENGENHARIAS IV                                    ","Progress in Photovoltaics (Print)","A1",2008
"0952-3278","ENGENHARIAS IV                                    ","Prostaglandins, Leukotrienes and Essential Fatty Acids","B2",2008
"0929-8665","ENGENHARIAS IV                                    ","Protein and Peptide Letters","B2",2008
"1469-8986","ENGENHARIAS IV                                    ","Psychophysiology (Cambridge. Online)","B1",2008
"0033-3506","ENGENHARIAS IV                                    ","Public Health (London)","B1",2008
"0033-3883","ENGENHARIAS IV                                    ","Publicationes Mathematicae (Debrecen)","B2",2008
"1533-7146","ENGENHARIAS IV                                    ","Quantum Information & Computation","A1",2008
"1570-0755","ENGENHARIAS IV                                    ","Quantum Information Processing (Print)","A2",2008
"0100-4042","ENGENHARIAS IV                                    ","Química Nova (Impresso)","B1",2008
"1350-4487","ENGENHARIAS IV                                    ","Radiation Measurements","B2",2008
"0167-8140","ENGENHARIAS IV                                    ","Radiotherapy and Oncology","B1",2008
"0034-7590","ENGENHARIAS IV                                    ","RAE (Impresso)","B5",2008
"0100-3984","ENGENHARIAS IV                                    ","RB. Radiologia Brasileira (Impresso)","B4",2008
"1808-0936","ENGENHARIAS IV                                    ","RBC. Revista Brasileira de Cartografia (Online)","B5",2008
"1516-9332","ENGENHARIAS IV                                    ","RBCF. Revista Brasileira de Ciências Farmacêuticas (Cessou em 2008. Cont. ISSN 1984-8250 Brazilian Journal of Pharmaceutical Sciences)","B5",2008
"0102-2644","ENGENHARIAS IV                                    ","RBE. Revista Brasileira de Engenharia. Caderno de Engenharia Biomédica","B1",2008
"1679-902X","ENGENHARIAS IV                                    ","RBGP. Revista Brasileira de Gerenciamento de Projetos","B5",2008
"0034-7264","ENGENHARIAS IV                                    ","RBM. Revista Brasileira de Medicina (Rio de Janeiro)","B3",2008
"1872-2105","ENGENHARIAS IV                                    ","Recent Patents in Nanotechnology","B5",2008
"1415-3262","ENGENHARIAS IV                                    ","RECITEC. Revista de ciência e tecnologia","B5",2008
"1139-207X","ENGENHARIAS IV                                    ","Red Iris","B5",2008
"0167-0115","ENGENHARIAS IV                                    ","Regulatory Peptides (Print)","B1",2008
"1678-2399","ENGENHARIAS IV                                    ","Relatórios de Pesquisa em Engenharia de Produção (UFF)","B5",2008
"1385-3139","ENGENHARIAS IV                                    ","Reliable Computing","B4",2008
"0370-4467","ENGENHARIAS IV                                    ","REM. Revista Escola de Minas (Impresso)","B3",2008
"1679-1916","ENGENHARIAS IV                                    ","RENOTE. Revista Novas Tecnologias na Educação","B5",2008
"0947-3602","ENGENHARIAS IV                                    ","Requirements Engineering (London. Print)","B1",2008
"0954-6111","ENGENHARIAS IV                                    ","Respiratory Medicine","B1",2008
"1569-9048","ENGENHARIAS IV                                    ","Respiratory Physiology & Neurobiology","B2",2008
"1806-0803","ENGENHARIAS IV                                    ","Reverte (Indaiatuba)","B5",2008
"0034-6748","ENGENHARIAS IV                                    ","Review of Scientific Instruments","A1",2008
"0104-3072","ENGENHARIAS IV                                    ","Revista ABO Nacional","B5",2008
"1562-3823","ENGENHARIAS IV                                    ","Revista Boliviana de Física","B4",2008
"1517-3267","ENGENHARIAS IV                                    ","Revista Brasileira de Agroinformática","B5",2008
"0104-1347","ENGENHARIAS IV                                    ","Revista Brasileira de Agrometeorologia","B5",2008
"0370-369X","ENGENHARIAS IV                                    ","Revista Brasileira de Analises Clinicas","B5",2008
"0101-7659","ENGENHARIAS IV                                    ","Revista Brasileira de Aplicações de Vácuo (Impresso)","B5",2008
"0100-3518","ENGENHARIAS IV                                    ","Revista Brasileira de Armazenamento","B5",2008
"1413-3482","ENGENHARIAS IV                                    ","Revista Brasileira de Atividade Física e Saúde","B5",2008
"1518-8191","ENGENHARIAS IV                                    ","Revista Brasileira de Biomecânica (Impresso)","B4",2008
"1983-0823","ENGENHARIAS IV                                    ","Revista Brasileira de Biometria","B3",2008
"0034-7116","ENGENHARIAS IV                                    ","Revista Brasileira de Cancerologia","B5",2008
"0560-4613","ENGENHARIAS IV                                    ","Revista Brasileira de Cartografia (Impresso)","B5",2008
"0103-1716","ENGENHARIAS IV                                    ","Revista Brasileira de Ciência e Movimento","B5",2008
"0100-7386","ENGENHARIAS IV                                    ","Revista Brasileira de Ciências Mecânicas","B4",2008
"1807-5509","ENGENHARIAS IV                                    ","Revista Brasileira de Educação Física e Esporte (Impresso)","B5",2008
"1983-0408","ENGENHARIAS IV                                    ","Revista Brasileira de Educação Profissional e Tecnológica","B5",2008
"0104-303X","ENGENHARIAS IV                                    ","Revista Brasileira de Energia","B5",2008
"1517-3151","ENGENHARIAS IV                                    ","Revista Brasileira de Engenharia Biomédica (Impresso)","B1",2008
"1677-2318","ENGENHARIAS IV                                    ","Revista Brasileira de Ensino de Bioquímica e Biologia Molecular","B5",2008
"1806-1117","ENGENHARIAS IV                                    ","Revista Brasileira de Ensino de Física (Impresso)","B5",2008
"1415-790X","ENGENHARIAS IV                                    ","Revista Brasileira de Epidemiologia (Impresso)","B3",2008
"0034-7175","ENGENHARIAS IV                                    ","Revista Brasileira de Estatística","B5",2008
"0102-695X","ENGENHARIAS IV                                    ","Revista Brasileira de Farmacognosia (Impresso)","B4",2008
"1679-0731","ENGENHARIAS IV                                    ","Revista Brasileira de Finanças","B5",2008
"1413-3555","ENGENHARIAS IV                                    ","Revista Brasileira de Fisioterapia (Impresso)","B4",2008
"1809-239X","ENGENHARIAS IV                                    ","Revista Brasileira de Gestão e Desenvolvimento Regional","B5",2008
"1414-5685","ENGENHARIAS IV                                    ","Revista Brasileira de Informação na Educação","B5",2008
"1517-8692","ENGENHARIAS IV                                    ","Revista Brasileira de Medicina do Esporte (Impresso)","B3",2008
"0102-7786","ENGENHARIAS IV                                    ","Revista Brasileira de Meteorologia (Impresso)","B4",2008
"0101-8469","ENGENHARIAS IV                                    ","Revista Brasileira de Neurologia","B4",2008
"0034-7272","ENGENHARIAS IV                                    ","Revista Brasileira de Odontologia","B5",2008
"0102-3616","ENGENHARIAS IV                                    ","Revista Brasileira de Ortopedia (Impresso)","B5",2008
"1518-8698","ENGENHARIAS IV                                    ","Revista Brasileira de Ortopedia Pediátrica","B5",2008
"1516-0572","ENGENHARIAS IV                                    ","Revista Brasileira de Plantas Medicinais (Impresso)","B4",2008
"1516-4446","ENGENHARIAS IV                                    ","Revista Brasileira de Psiquiatria (São Paulo. 1999. Impresso)","B3",2008
"1414-381X","ENGENHARIAS IV                                    ","Revista Brasileira de Recursos Hídricos","B5",2008
"1983-4217","ENGENHARIAS IV                                    ","Revista Brasileira de Redes de Computadores e Sistemas Distribuídos","B5",2008
"1980-2013","ENGENHARIAS IV                                    ","Revista Brasileira de Risco e Seguro (Impresso)","B5",2008
"0101-0794","ENGENHARIAS IV                                    ","Revista C & I. Controle & Instrumentação","B5",2008
"1517-6363","ENGENHARIAS IV                                    ","Revista Ceciliana","B5",2008
"1677-9649","ENGENHARIAS IV                                    ","Revista Ciência e Tecnologia","B5",2008
"1518-0352","ENGENHARIAS IV                                    ","Revista Ciências Exatas e Naturais (Impresso)","B4",2008
"1981-6014","ENGENHARIAS IV                                    ","Revista Científica da UFPA","B5",2008
"0103-1959","ENGENHARIAS IV                                    ","Revista Controle & Automação da Sociedade Brasileira de Automação","B1",2008
"1414-7564","ENGENHARIAS IV                                    ","Revista da ANPOLL (Impresso)","B5",2008
"0104-4230","ENGENHARIAS IV                                    ","Revista da Associação Médica Brasileira (1992. Impresso)","B3",2008
"1517-4611","ENGENHARIAS IV                                    ","Revista da EAP/APCD","B5",2008
"1516-8034","ENGENHARIAS IV                                    ","Revista da Sociedade Brasileira de Fonoaudiologia (Impresso)","B5",2008
"0037-8682","ENGENHARIAS IV                                    ","Revista da Sociedade Brasileira de Medicina Tropical (Impresso)","B2",2008
"0102-986X","ENGENHARIAS IV                                    ","Revista da Sociedade Brasileira de Telecomunicações","B1",2008
"0103-8559","ENGENHARIAS IV                                    ","Revista da Sociedade de Cardiologia do Estado de Sao Paulo","B5",2008
"0103-8575","ENGENHARIAS IV                                    ","Revista de Ciência & Tecnologia","B5",2008
"1980-1793","ENGENHARIAS IV                                    ","Revista de Ciências Exatas e Tecnologia (Anhanguera Educacional, Valinhos)","B5",2008
"1808-4532","ENGENHARIAS IV                                    ","Revista de Ciências Farmacêuticas Básica e Aplicada","B5",2008
"1981-1020","ENGENHARIAS IV                                    ","Revista de Direito das Novas Tecnologias","B5",2008
"0101-7012","ENGENHARIAS IV                                    ","Revista de Econometria","B4",2008
"1676-7608","ENGENHARIAS IV                                    ","Revista de Economia e Administração (Impresso)","B5",2008
"0101-3157","ENGENHARIAS IV                                    ","Revista de Economia Política (Impresso)","B5",2008
"1678-8435","ENGENHARIAS IV                                    ","Revista de Engenharia de Computação e Sistemas Digitais (Impresso)","B4",2008
"0101-5001","ENGENHARIAS IV                                    ","Revista de Ensino de Engenharia","B5",2008
"0102-4744","ENGENHARIAS IV                                    ","Revista de Ensino de Física (Cessou em 1991. Cont.ISSN 1806-1117 Revista Brasileira de Ensino de Física (Impresso)","B5",2008
"0104-0588","ENGENHARIAS IV                                    ","Revista de Estudos da Linguagem","B5",2008
"0102-6895","ENGENHARIAS IV                                    ","Revista de Física Aplicada e Instrumentação","B4",2008
"1518-2282","ENGENHARIAS IV                                    ","Revista de Fisioterapia da UNICID","B5",2008
"1413-7879","ENGENHARIAS IV                                    ","Revista de Fisioterapia da Universidade de São Paulo","B5",2008
"1807-1775","ENGENHARIAS IV                                    ","Revista de Gestão da Tecnologia e Sistemas de Informação (Online)","B3",2008
"0103-4308","ENGENHARIAS IV                                    ","Revista de Informática Teórica e Aplicada (Impresso)","B5",2008
"0717-1072","ENGENHARIAS IV                                    ","Revista de la Facultad de Ingeniería - Universidad de Tarapacá (Impresa) (Cessou em 2006. Cont. ISSN 0718-3291 Ingeniare. Revista Chilena de Ingeniería (Impresa)","B5",2008
"0102-0811","ENGENHARIAS IV                                    ","Revista de Matemática e Estatística (Impresso) (Cessou em 2004. Cont. ISSN 1980-4245 Revista de Matemática e Estatística (Online))","B4",2008
"0104-3579","ENGENHARIAS IV                                    ","Revista de Neurociências (EPM. Impresso)","B4",2008
"0210-0010","ENGENHARIAS IV                                    ","Revista de Neurología (Ed. Impresa)","B2",2008
"1981-4984","ENGENHARIAS IV                                    ","Revista de Radiodifusão","B5",2008
"0034-8910","ENGENHARIAS IV                                    ","Revista de Saúde Pública (USP. Impresso)","B3",2008
"1415-5419","ENGENHARIAS IV                                    ","Revista Dental Press de Ortodontia e Ortopedia Facial (Impresso)","B3",2008
"1415-2061","ENGENHARIAS IV                                    ","Revista do CCEI","B5",2008
"0041-8781","ENGENHARIAS IV                                    ","Revista do Hospital das Clínicas (USP. Impresso) (Cessou em 2004. Cont. ISSN 1807-5932 Clinics (São Paulo. Impresso))","B4",2008
"0102-7212","ENGENHARIAS IV                                    ","Revista dos Transportes Públicos","B4",2008
"1019-8113","ENGENHARIAS IV                                    ","Revista Ecuatoriana de Neurología","B2",2008
"1519-8219","ENGENHARIAS IV                                    ","Revista Eletrônica de Iniciação Científica","B5",2008
"1806-0021","ENGENHARIAS IV                                    ","Revista Engenharia FAAP","B5",2008
"1808-0448","ENGENHARIAS IV                                    ","Revista Gestão Industrial","B5",2008
"1548-0992","ENGENHARIAS IV                                    ","Revista IEEE América Latina","B3",2008
"1577-0354","ENGENHARIAS IV                                    ","Revista Internacional de Medicina y Ciencias de la Actividad Física y del Deporte","B3",2008
"0100-0888","ENGENHARIAS IV                                    ","Revista Letras (Curitiba)","B5",2008
"1806-3381","ENGENHARIAS IV                                    ","Revista Lumière (Impresso)","B5",2008
"1678-2577","ENGENHARIAS IV                                    ","Revista Mackenzie de Educação Física e Esporte","B5",2008
"0035-001X","ENGENHARIAS IV                                    ","Revista Mexicana de Física","B2",2008
"0102-9460","ENGENHARIAS IV                                    ","Revista Odonto Ciência (PUCRS. Impresso)","B4",2008
"0329-5001","ENGENHARIAS IV                                    ","Revista Petroquímica, Petróleo, Gas & Química","B5",2008
"1981-8521","ENGENHARIAS IV                                    ","Revista Processos Químicos","B5",2008
"1676-1901","ENGENHARIAS IV                                    ","Revista Produção Online","B4",2008
"0101-8191","ENGENHARIAS IV                                    ","Revista Tecnologia (UNIFOR)","B5",2008
"1516-9197","ENGENHARIAS IV                                    ","Revista Tecnologia da Informação","B5",2008
"1517-3275","ENGENHARIAS IV                                    ","Revista UNIVAP","B5",2008
"1414-0578","ENGENHARIAS IV                                    ","Revista Universidade Rural. Série Ciências Exatas e da Terra (UFRRJ)","B5",2008
"1519-6402","ENGENHARIAS IV                                    ","Revista Visão Universitária","B5",2008
"1982-6443","ENGENHARIAS IV                                    ","Rio's International Journal on Sciences of Industrial and Systems Engineering and Management","B5",2008
"0035-5593","ENGENHARIAS IV                                    ","Risk Management","B5",2008
"0263-5747","ENGENHARIAS IV                                    ","Robotica (Cambridge. Print)","A2",2008
"0921-8890","ENGENHARIAS IV                                    ","Robotics and Autonomous Systems (Print)","A2",2008
"0736-5845","ENGENHARIAS IV                                    ","Robotics and Computer-Integrated Manufacturing","B1",2008
"1808-3544","ENGENHARIAS IV                                    ","RTI. Redes, Telecom e Instalações","B5",2008
"1980-5160","ENGENHARIAS IV                                    ","S & G. Sistemas & Gestão","B5",2008
"0920-9964","ENGENHARIAS IV                                    ","Schizophrenia Research (Print)","B1",2008
"1095-9203","ENGENHARIAS IV                                    ","Science (New York, N.Y.: Online)","A2",2008
"0167-6423","ENGENHARIAS IV                                    ","Science of Computer Programming (Print)","B1",2008
"0104-1770","ENGENHARIAS IV                                    ","Scientia (UNISINOS)","B5",2008
"0122-1701","ENGENHARIAS IV                                    ","Scientia et Technica","B5",2008
"0304-4238","ENGENHARIAS IV                                    ","Scientia Horticulturae","B2",2008
"1806-5562","ENGENHARIAS IV                                    ","Scientia Medica (PUCRS. Impresso)","B5",2008
"1678-3166","ENGENHARIAS IV                                    ","Scientiae Studia (USP)","B5",2008
"1359-6462","ENGENHARIAS IV                                    ","Scripta Materialia (Oxford)","B1",2008
"0093-3651","ENGENHARIAS IV                                    ","Sea Technology","B2",2008
"1492-3157","ENGENHARIAS IV                                    ","SEED Journal. Semiotics, Evolution, Energy, and Development","B5",2008
"1809-0648","ENGENHARIAS IV                                    ","Seleção Documental","B5",2008
