"1807-9792","ENGENHARIAS IV                                    ","Abstracta : linguagem, mente e ação (Niterói)","B5",2008
"0103-0736","ENGENHARIAS IV                                    ","Acesso (São Paulo)","B5",2008
"1525-9293","ENGENHARIAS IV                                    ","ACIS International Journal of Computer and Information Science","B5",2008
"1084-4309","ENGENHARIAS IV                                    ","ACM Transactions on Design Automation of Electronic Systems","A2",2008
"0098-3500","ENGENHARIAS IV                                    ","ACM Transactions on Mathematical Software","B1",2008
"0001-5172","ENGENHARIAS IV                                    ","Acta Anaesthesiologica Scandinavica","B1",2008
"0094-5765","ENGENHARIAS IV                                    ","Acta Astronautica","B2",2008
"0102-8650","ENGENHARIAS IV                                    ","Acta Cirúrgica Brasileira (Impresso)","B3",2008
"0353-8109","ENGENHARIAS IV                                    ","Acta Informatica Medica","B5",2008
"0798-4545","ENGENHARIAS IV                                    ","Acta Microscópica - Interamerican Committee of Societies for Electron Microscopy","B5",2008
"1413-7852","ENGENHARIAS IV                                    ","Acta Ortopédica Brasileira (Impresso)","B4",2008
"0001-6969","ENGENHARIAS IV                                    ","Acta Scientiarum Mathematicarum","B4",2008
"1518-0204","ENGENHARIAS IV                                    ","Activity Report (Laboratório Nacional de Luz Síncrotron)","B5",2008
"0044-0027","ENGENHARIAS IV                                    ","Adernaâ Fizika / Journal of Nuclear Physics","B5",2008
"0921-8831","ENGENHARIAS IV                                    ","Advanced Powder Technology (Print)","B1",2008
"1615-4150","ENGENHARIAS IV                                    ","Advanced Synthesis & Catalysis (Print)","A2",2008
"0219-5259","ENGENHARIAS IV                                    ","Advances in Complex Systems","B2",2008
"0965-9978","ENGENHARIAS IV                                    ","Advances in Engineering Software (1992)","B1",2008
"1343-4373","ENGENHARIAS IV                                    ","Advances in Mathematical Sciences and Applications","B5",2008
"0730-6679","ENGENHARIAS IV                                    ","Advances in Polymer Technology (Print)","B3",2008
"1615-3871","ENGENHARIAS IV                                    ","Advances in Soft Computing","B5",2008
"0273-1177","ENGENHARIAS IV                                    ","Advances in Space Research","B1",2008
"1270-9638","ENGENHARIAS IV                                    ","Aerospace Science and Technology (Imprimé)","B1",2008
"1434-8411","ENGENHARIAS IV                                    ","AEU. International Journal of Electronics and Communications (Print)","B1",2008
"0161-9152","ENGENHARIAS IV                                    ","AGE (Omaha) (Cessou em 1999. Cont. Journal of the American Aging Association)","A1",2008
"0002-2667","ENGENHARIAS IV                                    ","Aircraft Engineering (Cessou em 1986. Cont. ISSN 1748-8842 Aircraft Engineering and Aerospace Technology)","B2",2008
"1413-0394","ENGENHARIAS IV                                    ","Aletheia (ULBRA)","B5",2008
"1062-3264","ENGENHARIAS IV                                    ","American Journal of Critical Care","B1",2008
"0894-8275","ENGENHARIAS IV                                    ","American Journal of Dentistry","B2",2008
"0889-5406","ENGENHARIAS IV                                    ","American Journal of Orthodontics and Dentofacial Orthopedics","B1",2008
"0002-9505","ENGENHARIAS IV                                    ","American Journal of Physics","B2",2008
"0363-6135","ENGENHARIAS IV                                    ","American Journal of Physiology. Heart and Circulatory Physiology","B1",2008
"0365-0596","ENGENHARIAS IV                                    ","Anais Brasileiros de Dermatologia (Impresso)","B5",2008
"0925-1030","ENGENHARIAS IV                                    ","Analog Integrated Circuits and Signal Processing","A2",2008
"0003-2670","ENGENHARIAS IV                                    ","Analytica Chimica Acta (Print)","B1",2008
"1618-2642","ENGENHARIAS IV                                    ","Analytical and Bioanalytical Chemistry","B1",2008
"0003-2697","ENGENHARIAS IV                                    ","Analytical Biochemistry (Print)","B1",2008
"0003-2700","ENGENHARIAS IV                                    ","Analytical Chemistry (Washington)","A2",2008
"0910-6340","ENGENHARIAS IV                                    ","Analytical Sciences","B1",2008
"0003-3022","ENGENHARIAS IV                                    ","Anesthesiology (Philadelphia)","A2",2008
"1672-352X","ENGENHARIAS IV                                    ","Anhui Nongye Daxue Xuebao / Journal of Anhui Agricultural University","B5",2008
"0003-4088","ENGENHARIAS IV                                    ","Annales de Limnologie","B2",2008
"0003-4347","ENGENHARIAS IV                                    ","Annales des Télécommunications (Cessou em 2007)","A2",2008
"0090-6964","ENGENHARIAS IV                                    ","Annals of Biomedical Engineering","A1",2008
"1047-2797","ENGENHARIAS IV                                    ","Annals of Epidemiology","B1",2008
"0254-5330","ENGENHARIAS IV                                    ","Annals of Operation Research","A2",2008
"1572-9338","ENGENHARIAS IV                                    ","Annals of Operations Research (Dordrecht. Online)","A2",2008
"1022-7091","ENGENHARIAS IV                                    ","Annals of Software Engineering (Cessou em 2002)","B3",2008
"1367-5788","ENGENHARIAS IV                                    ","Annual Reviews in Control","A2",2008
"0066-4804","ENGENHARIAS IV                                    ","Antimicrobial Agents and Chemotherapy (Print)","B1",2008
"1063-5203","ENGENHARIAS IV                                    ","Applied and Computational Harmonic Analysis (Print)","B1",2008
"0883-9514","ENGENHARIAS IV                                    ","Applied Artificial Intelligence","A2",2008
"1175-5636","ENGENHARIAS IV                                    ","Applied Bioinformatics","B4",2008
"0926-860X","ENGENHARIAS IV                                    ","Applied Catalysis. A, General (Print)","B1",2008
"1350-4851","ENGENHARIAS IV                                    ","Applied Economics Letters (Print)","B2",2008
"0924-669X","ENGENHARIAS IV                                    ","Applied Intelligence (Boston)","B2",2008
"0307-904X","ENGENHARIAS IV                                    ","Applied Mathematical Modelling","B1",2008
"0096-3003","ENGENHARIAS IV                                    ","Applied Mathematics and Computation","B1",2008
"0003-6935","ENGENHARIAS IV                                    ","Applied Optics (Cessou em 1989. Foi desdobrado em três: ISSN 1540-8973 Applied Optics. Information Processing, Applied Optics. Optical Technology e Applied Optics. Lasers and Photonics)","A1",2008
"0003-6951","ENGENHARIAS IV                                    ","Applied Physics Letters","A2",2008
"0947-8396","ENGENHARIAS IV                                    ","Applied Physics. A, Materials Science & Processing (Print)","B1",2008
"1568-4946","ENGENHARIAS IV                                    ","Applied Soft Computing (Print)","A2",2008
"1524-1904","ENGENHARIAS IV                                    ","Applied Stochastic Models in Business and Industry (Print)","B2",2008
"0169-4332","ENGENHARIAS IV                                    ","Applied Surface Science","A1",2008
"1734-1922","ENGENHARIAS IV                                    ","Archives of Medical Science","B5",2008
"0102-0935","ENGENHARIAS IV                                    ","Arquivo Brasileiro de Medicina Veterinária e Zootecnia","A2",2008
"1808-2998","ENGENHARIAS IV                                    ","Arquivo Brasileiro de Odontologia (Arq. Bras. odontol.)","B5",2008
"0004-2749","ENGENHARIAS IV                                    ","Arquivos Brasileiros de Oftalmologia (Impresso)","B4",2008
"0004-2773","ENGENHARIAS IV                                    ","Arquivos Catarinenses de Medicina (Impresso)","B5",2008
"1806-4280","ENGENHARIAS IV                                    ","Arquivos Catarinenses de Medicina (Online)","B5",2008
"0004-282X","ENGENHARIAS IV                                    ","Arquivos de Neuro-Psiquiatria (Impresso)","B2",2008
"0004-3702","ENGENHARIAS IV                                    ","Artificial Intelligence (General ed.)","A1",2008
"0924-8463","ENGENHARIAS IV                                    ","Artificial Intelligence and Law (Dordrecht. Print)","B3",2008
"0954-1810","ENGENHARIAS IV                                    ","Artificial Intelligence in Engineering (Cessou em 2001. Cont. ISSN 1474-0346 Advanced Engineering Informatics)","B2",2008
"0933-3657","ENGENHARIAS IV                                    ","Artificial Intelligence in Medicine (Print)","A2",2008
"1433-5298","ENGENHARIAS IV                                    ","Artificial Life and Robotics (Print)","B4",2008
"0160-564X","ENGENHARIAS IV                                    ","Artificial Organs","A1",2008
"0217-5959","ENGENHARIAS IV                                    ","Asia-Pacific Journal of Operational Research","B2",2008
"1561-8625","ENGENHARIAS IV                                    ","Asian Journal of Control","A2",2008
"0004-6361","ENGENHARIAS IV                                    ","Astronomy & Astrophysics (Berlin. Print)","B1",2008
"0004-9425","ENGENHARIAS IV                                    ","Australian Journal of Chemistry (Print)","B1",2008
"0005-1098","ENGENHARIAS IV                                    ","Automatica (Oxford)","A1",2008
"0095-6562","ENGENHARIAS IV                                    ","Aviation, Space, and Environmental Medicine","B2",2008
"1809-5577","ENGENHARIAS IV                                    ","Bio Farma","B5",2008
"0304-4165","ENGENHARIAS IV                                    ","Biochimica et Biophysica Acta. G, General Subjects (Print)","B1",2008
"1570-9639","ENGENHARIAS IV                                    ","Biochimica et Biophysica Acta. Proteins and Proteomics","B2",2008
"0300-9084","ENGENHARIAS IV                                    ","Biochimie (Paris. Print)","B1",2008
"1567-5394","ENGENHARIAS IV                                    ","Bioelectrochemistry (Amsterdam)","B2",2008
"0302-4598","ENGENHARIAS IV                                    ","Bioelectrochemistry and Bioenergetics (Print) (Cessou em 2000. Cont.1567-5394 Bioelectrochemistry (Amsterdam)","B1",2008
"1367-4803","ENGENHARIAS IV                                    ","Bioinformatics (Oxford. Print)","A1",2008
"1431-6730","ENGENHARIAS IV                                    ","Biological Chemistry (Print)","B1",2008
"0340-1200","ENGENHARIAS IV                                    ","Biological Cybernetics","B2",2008
"1679-365X","ENGENHARIAS IV                                    ","Biomatemática (UNICAMP)","B5",2008
"0142-9612","ENGENHARIAS IV                                    ","Biomaterials (Guildford)","A1",2008
"1475-925X","ENGENHARIAS IV                                    ","BioMedical Engineering Online (Online)","A2",2008
"1746-8094","ENGENHARIAS IV                                    ","Biomedical Signal Processing and Control (Print)","B1",2008
"0960-894X","ENGENHARIAS IV                                    ","Bioorganic & Medicinal Chemistry Letters (Print)","B1",2008
"0301-4622","ENGENHARIAS IV                                    ","Biophysical Chemistry (Print)","B2",2008
"0956-5663","ENGENHARIAS IV                                    ","Biosensors & Bioelectronics","A1",2008
"1537-5110","ENGENHARIAS IV                                    ","Biosystems Engineering","A2",2008
"1528-0020","ENGENHARIAS IV                                    ","Blood (Philadelphia. Online)","A2",2008
"1359-5237","ENGENHARIAS IV                                    ","Blood Pressure Monitoring","B2",2008
"1471-2164","ENGENHARIAS IV                                    ","BMC Genomics","B1",2008
"1471-2350","ENGENHARIAS IV                                    ","BMC Medical Genetics (Online)","B1",2008
"1752-0509","ENGENHARIAS IV                                    ","BMC Systems Biology","B1",2008
"1413-215X","ENGENHARIAS IV                                    ","Boletim Técnico da Escola Politécnica da USP. BT/PCS","B5",2008
"1518-9082","ENGENHARIAS IV                                    ","Boletim Técnico da Faculdade de Tecnologia de São Paulo","B5",2008
"0006-8993","ENGENHARIAS IV                                    ","Brain Research","B1",2008
"1516-8913","ENGENHARIAS IV                                    ","Brazilian Archives of Biology and Technology (Impresso)","B1",2008
"0103-6440","ENGENHARIAS IV                                    ","Brazilian Dental Journal (Impresso)","B3",2008
"0104-6632","ENGENHARIAS IV                                    ","Brazilian Journal of Chemical Engineering (Impresso)","B1",2008
"0104-9275","ENGENHARIAS IV                                    ","Brazilian Journal of Epilepsy and Clinical Neurophysiology (Cessou em 2001. Cont. ISSN 1676-2649 Journal of Epilepsy and Clinical Neurophysiology (Impresso))","B5",2008
"0100-879X","ENGENHARIAS IV                                    ","Brazilian Journal of Medical and Biological Research (Impresso)","A2",2008
"1678-4510","ENGENHARIAS IV                                    ","brazilian journal of medical and biological research -on line","B3",2008
"1517-8382","ENGENHARIAS IV                                    ","Brazilian Journal of Microbiology (Impresso)","B2",2008
"0103-9733","ENGENHARIAS IV                                    ","Brazilian Journal of Physics (Impresso)","B2",2008
"1517-6878","ENGENHARIAS IV                                    ","Brazilian Journal of Urology (Cessou em 2002. Cont. ISSN 1677-5538 International Braz J Urol (Impresso))","B5",2008
"1806-8324","ENGENHARIAS IV                                    ","Brazilian Oral Research (Impresso)","B3",2008
"0092-8240","ENGENHARIAS IV                                    ","Bulletin of Mathematical Biology (Print)","B2",2008
"1370-1444","ENGENHARIAS IV                                    ","Bulletin of the Belgian Mathematical Society Simon Stevin","B2",2008
"1015-8634","ENGENHARIAS IV                                    ","Bulletin of the Korean Mathematical Society","B4",2008
"0102-3543","ENGENHARIAS IV                                    ","C&T. Revista Militar de Ciência e Tecnologia","B5",2008
"1677-2334","ENGENHARIAS IV                                    ","Caderno Brasileiro de Ensino de Física","B5",2008
"0102-3594","ENGENHARIAS IV                                    ","Caderno Catarinense de Ensino de Física (Cessou em 2001. Cont. ISSN 1677-2334 Caderno Brasileiro de Ensino de Física)","B5",2008
"1809-1946","ENGENHARIAS IV                                    ","Cadernos CPQD Tecnologia","B5",2008
"0102-5767","ENGENHARIAS IV                                    ","Cadernos de Estudos Linguísticos (UNICAMP)","B5",2008
"0102-311X","ENGENHARIAS IV                                    ","Cadernos de Saúde Pública (ENSP. Impresso)","B3",2008
"1414-462X","ENGENHARIAS IV                                    ","Cadernos Saúde Coletiva (UFRJ)","B4",2008
"1809-4694","ENGENHARIAS IV                                    ","Cadernos Temáticos (Impresso)","B5",2008
"0144-8617","ENGENHARIAS IV                                    ","Carbohydrate Polymers","B1",2008
"0008-6223","ENGENHARIAS IV                                    ","Carbon (New York)","B1",2008
"0008-6363","ENGENHARIAS IV                                    ","Cardiovascular Research","A2",2008
"0008-6568","ENGENHARIAS IV                                    ","Caries Research","B1",2008
"1085-9195","ENGENHARIAS IV                                    ","Cell Biochemistry and Biophysics","B2",2008
"1065-6995","ENGENHARIAS IV                                    ","Cell Biology International (Print)","B2",2008
"0143-4160","ENGENHARIAS IV                                    ","Cell Calcium (Edinburgh)","B1",2008
"0366-6913","ENGENHARIAS IV                                    ","Cerâmica (São Paulo. Impresso)","B3",2008
"1054-1500","ENGENHARIAS IV                                    ","Chaos (Woodbury, N.Y.)","A2",2008
"0960-0779","ENGENHARIAS IV                                    ","Chaos, Solitons and Fractals","A2",2008
"0897-4756","ENGENHARIAS IV                                    ","Chemistry of Materials","A2",2008
"0169-7439","ENGENHARIAS IV                                    ","Chemometrics and Intelligent Laboratory Systems (Print)","B1",2008
"0256-307X","ENGENHARIAS IV                                    ","Chinese Physics Letters","B2",2008
"0103-944X","ENGENHARIAS IV                                    ","Ciência & Engenharia (UFU. Impresso)","B5",2008
"1518-2797","ENGENHARIAS IV                                    ","Ciência Animal Brasileira (UFG. Impresso)","B5",2008
"0100-1965","ENGENHARIAS IV                                    ","Ciência da Informação (Impresso)","B4",2008
"1413-7054","ENGENHARIAS IV                                    ","Ciência e Agrotecnologia (UFLA)","B5",2008
"0101-8515","ENGENHARIAS IV                                    ","Ciência Hoje","B5",2008
"1678-2046","ENGENHARIAS IV                                    ","Ciência Odontológica Brasileira","B4",2008
"0103-8478","ENGENHARIAS IV                                    ","Ciência Rural (UFSM. Impresso)","B3",2008
"1806-5821","ENGENHARIAS IV                                    ","Ciências & Cognição (UFRJ)","B5",2008
"0278-081X","ENGENHARIAS IV                                    ","Circuits, Systems, and Signal Processing","B1",2008
"0009-7322","ENGENHARIAS IV                                    ","Circulation (New York, N.Y.)","A2",2008
"0264-9381","ENGENHARIAS IV                                    ","Classical and Quantum Gravity (Print)","B1",2008
"0717-5000","ENGENHARIAS IV                                    ","CLEI Electronic Journal","B5",2008
"0269-2155","ENGENHARIAS IV                                    ","Clinical Rehabilitation","B1",2008
"1807-5932","ENGENHARIAS IV                                    ","Clinics (USP. Impresso)","B5",2008
"1386-7857","ENGENHARIAS IV                                    ","Cluster Computing","B2",2008
"1809-8428","ENGENHARIAS IV                                    ","Cognitio-Estudos (PUC-SP. Online)","B5",2008
"0303-402X","ENGENHARIAS IV                                    ","Colloid and Polymer Science (Print)","B1",2008
"1007-5704","ENGENHARIAS IV                                    ","Communications in Nonlinear Science & Numerical Simulation","B3",2008
"0361-0926","ENGENHARIAS IV                                    ","Communications in Statistics. Theory and Methods","B2",2008
"1532-415X","ENGENHARIAS IV                                    ","Communications in Statistics. Theory and Methods (Online)","B2",2008
"1095-6433","ENGENHARIAS IV                                    ","Comparative Biochemistry and Physiology. Part A, Molecular & Integrative Physiology","B2",2008
"0332-1649","ENGENHARIAS IV                                    ","Compel (Bradford)","A2",2008
"1381-298X","ENGENHARIAS IV                                    ","Computational and Mathematical Organization Theory","B5",2008
"1476-9271","ENGENHARIAS IV                                    ","Computational Biology and Chemistry (Print)","B1",2008
"0178-7675","ENGENHARIAS IV                                    ","Computational Mechanics","B1",2008
"1432-0924","ENGENHARIAS IV                                    ","Computational Mechanics (Berlin. Internet)","B1",2008
"0167-9473","ENGENHARIAS IV                                    ","Computational Statistics & Data Analysis (Print)","B2",2008
"0943-4062","ENGENHARIAS IV                                    ","Computational Statistics (Zeitschrift)","B2",2008
"0167-8396","ENGENHARIAS IV                                    ","Computer Aided Geometric Design","B1",2008
"1061-3773","ENGENHARIAS IV                                    ","Computer Applications in Engineering Education","B2",2008
"0146-4833","ENGENHARIAS IV                                    ","Computer Communication Review","B2",2008
"0140-3664","ENGENHARIAS IV                                    ","Computer Communications","A2",2008
"0097-8930","ENGENHARIAS IV                                    ","Computer Graphics (Cessou em 2005)","B1",2008
"0169-2607","ENGENHARIAS IV                                    ","Computer Methods and Programs in Biomedicine (Print)","A2",2008
"0045-7825","ENGENHARIAS IV                                    ","Computer Methods in Applied Mechanics and Engineering","A2",2008
"1526-1492","ENGENHARIAS IV                                    ","Computer Modeling in Engineering & Sciences (Print)","A2",2008
"1389-1286","ENGENHARIAS IV                                    ","Computer Networks (1999)","A1",2008
"0010-4655","ENGENHARIAS IV                                    ","Computer Physics Communications","B1",2008
"0920-5489","ENGENHARIAS IV                                    ","Computer Standards & Interfaces","B1",2008
"0267-6192","ENGENHARIAS IV                                    ","Computer Systems Science and Engineering","B1",2008
"1077-3142","ENGENHARIAS IV                                    ","Computer Vision and Image Understanding (Print)","A1",2008
"0895-6111","ENGENHARIAS IV                                    ","Computerized Medical Imaging and Graphics","B2",2008
"0098-1354","ENGENHARIAS IV                                    ","Computers & Chemical Engineering","A2",2008
"0045-7906","ENGENHARIAS IV                                    ","Computers & Electrical Engineering","B1",2008
"0097-8493","ENGENHARIAS IV                                    ","Computers & Graphics","B2",2008
"0360-8352","ENGENHARIAS IV                                    ","Computers & Industrial Engineering","B1",2008
"0898-1221","ENGENHARIAS IV                                    ","Computers & Mathematics with Applications (1987)","B1",2008
"0305-0548","ENGENHARIAS IV                                    ","Computers & Operations Research","B1",2008
"0167-4048","ENGENHARIAS IV                                    ","Computers & Security","B2",2008
"0045-7949","ENGENHARIAS IV                                    ","Computers & Structures","B1",2008
"0360-1315","ENGENHARIAS IV                                    ","Computers and Education","B1",2008
"0168-1699","ENGENHARIAS IV                                    ","Computers and Electronics in Agriculture","B1",2008
"0010-4825","ENGENHARIAS IV                                    ","Computers in Biology and Medicine","A2",2008
"0276-6574","ENGENHARIAS IV                                    ","Computers in Cardiology","B4",2008
"0010-4884","ENGENHARIAS IV                                    ","Computing Reviews","B4",2008
"0101-2657","ENGENHARIAS IV                                    ","Comunicação & Sociedade","B5",2008
"1532-0626","ENGENHARIAS IV                                    ","Concurrency and Computation","B1",2008
"1677-1028","ENGENHARIAS IV                                    ","ConScientiae Saúde (Impresso)","B5",2008
"1806-0579","ENGENHARIAS IV                                    ","Contexto Radial (São Paulo)","B5",2008
"0967-0661","ENGENHARIAS IV                                    ","Control Engineering Practice","A1",2008
"0272-1708","ENGENHARIAS IV                                    ","Control Systems Magazine","A1",2008
"0103-1759","ENGENHARIAS IV                                    ","Controle & Automação (Impresso)","B1",2008
"1807-0345","ENGENHARIAS IV                                    ","Controle & Automação (Online)","B1",2008
"0886-9634","ENGENHARIAS IV                                    ","Cranio. Journal of Craniomandibular Practice","B2",2008
"0090-3493","ENGENHARIAS IV                                    ","Critical Care Medicine","A2",2008
"1677-6496","ENGENHARIAS IV                                    ","CTAI : Revista de Automação e Tecnologia da Informação (Cessou em 2003. Cont. 1983-1838 E-tech: Tecnologias para Competitividade Industrial)","B5",2008
"0973-5607","ENGENHARIAS IV                                    ","Current Development in Theory and Applications of Wavelets","B5",2008
"1552-4922","ENGENHARIAS IV                                    ","Cytometry. Part A","B1",2008
"0011-4626","ENGENHARIAS IV                                    ","Czechoslovak Journal of Physics (Prague, Print) Cessou em 2006)","B2",2008
"0011-5258","ENGENHARIAS IV                                    ","Dados (Rio de Janeiro. Impresso)","B3",2008
"0169-023X","ENGENHARIAS IV                                    ","Data & Knowledge Engineering","B1",2008
"1384-5810","ENGENHARIAS IV                                    ","Data Mining and Knowledge Discovery","B1",2008
"0287-4547","ENGENHARIAS IV                                    ","Dental Materials Journal","B2",2008
"1076-0512","ENGENHARIAS IV                                    ","Dermatologic Surgery","B1",2008
"0929-5585","ENGENHARIAS IV                                    ","Design Automation for Embedded Systems","A2",2008
"0925-1022","ENGENHARIAS IV                                    ","Designs, Codes and Cryptography","A2",2008
"0168-8227","ENGENHARIAS IV                                    ","Diabetes Research and Clinical Practice (Print)","B2",2008
"0742-3071","ENGENHARIAS IV                                    ","Diabetic Medicine","B1",2008
"0012-186X","ENGENHARIAS IV                                    ","Diabetologia (Berlin)","B1",2008
