"0740-817X","ENGENHARIAS IV                                    ","IIE Transactions","B1",2008
"0262-8856","ENGENHARIAS IV                                    ","Image and Vision Computing","A1",2008
"0254-9395","ENGENHARIAS IV                                    ","Indian Journal of Leprosy","B5",2008
"0888-5885","ENGENHARIAS IV                                    ","Industrial & Engineering Chemistry Research","A2",2008
"0360-3997","ENGENHARIAS IV                                    ","Inflammation","B2",2008
"1023-3830","ENGENHARIAS IV                                    ","Inflammation Research (Printed ed.)","B2",2008
"1807-4545","ENGENHARIAS IV                                    ","INFOCOMP (UFLA. Impresso)","B5",2008
"1517-669X","ENGENHARIAS IV                                    ","Infogeo (Curitiba)","B5",2008
"0716-8756","ENGENHARIAS IV                                    ","Información Tecnológica (Impresa)","B4",2008
"0100-4409","ENGENHARIAS IV                                    ","Informações Econômicas (Impresso)","B5",2008
"0350-5596","ENGENHARIAS IV                                    ","Informatica (Ljubljana)","B3",2008
"0020-0190","ENGENHARIAS IV                                    ","Information Processing Letters (Print)","B2",2008
"0020-0255","ENGENHARIAS IV                                    ","Information Sciences","A1",2008
"1387-3326","ENGENHARIAS IV                                    ","Information Systems Frontiers (Print)","B2",2008
"1091-9856","ENGENHARIAS IV                                    ","INFORMS Journal on Computing","B1",2008
"0718-3305","ENGENHARIAS IV                                    ","Ingeniare. Revista Chilena de Ingeniería (En línea)","B5",2008
"0718-3291","ENGENHARIAS IV                                    ","Ingeniare. Revista Chilena de Ingeniería (Impresa)","B5",2008
"1519-1257","ENGENHARIAS IV                                    ","Innovations Journal","B5",2008
"1354-2575","ENGENHARIAS IV                                    ","Insight (Northampton)","B2",2008
"1073-9149","ENGENHARIAS IV                                    ","Instrumentation Science & Technology","A2",2008
"0192-303X","ENGENHARIAS IV                                    ","InTech (Durham, NC.)","B5",2008
"1518-6024","ENGENHARIAS IV                                    ","Intech Brasil (São Paulo)","B5",2008
"0378-620X","ENGENHARIAS IV                                    ","Integral Equations and Operator Theory","B2",2008
"1065-2469","ENGENHARIAS IV                                    ","Integral Transforms and Special Functions","B1",2008
"1058-4587","ENGENHARIAS IV                                    ","Integrated Ferroelectrics (Print)","A2",2008
"0167-9260","ENGENHARIAS IV                                    ","Integration (Amsterdam. Print)","A2",2008
"0342-4642","ENGENHARIAS IV                                    ","Intensive Care Medicine (Print)","B1",2008
"1518-7012","ENGENHARIAS IV                                    ","Interações (UCDB)","B5",2008
"0953-5438","ENGENHARIAS IV                                    ","Interacting with Computers","B1",2008
"0966-9795","ENGENHARIAS IV                                    ","Intermetallics (Barking)","B1",2008
"0735-1933","ENGENHARIAS IV                                    ","International Communications in Heat and Mass Transfer","B1",2008
"1567-5769","ENGENHARIAS IV                                    ","International Immunopharmacology (Print)","B2",2008
"0029-5981","ENGENHARIAS IV                                    ","International Journal for Numerical Methods in Engineering (Print)","A2",2008
"0271-2091","ENGENHARIAS IV                                    ","International Journal for Numerical Methods in Fluids (Print)","B2",2008
"0890-6327","ENGENHARIAS IV                                    ","International Journal of Adaptive Control and Signal Processing (Print)","A1",2008
"1383-5416","ENGENHARIAS IV                                    ","International Journal of Applied Electromagnetics and Mechanics","B1",2008
"1311-1728","ENGENHARIAS IV                                    ","International Journal of Applied Mathematics","B4",2008
"1641-876X","ENGENHARIAS IV                                    ","International Journal of Applied Mathematics and Computer Science","B4",2008
"0888-613X","ENGENHARIAS IV                                    ","International Journal of Approximate Reasoning","A1",2008
"1229-9138","ENGENHARIAS IV                                    ","International Journal of Automotive Technology (Seoul. Print)","A2",2008
"0218-1274","ENGENHARIAS IV                                    ","International Journal of Bifurcation and Chaos in Applied Sciences and Engineering","A2",2008
"1456-7857","ENGENHARIAS IV                                    ","International Journal of Bioelectromagnetism (Print)","B5",2008
"1083-4346","ENGENHARIAS IV                                    ","International Journal of Business","B5",2008
"0167-5273","ENGENHARIAS IV                                    ","International Journal of Cardiology (Print)","B1",2008
"1074-5351","ENGENHARIAS IV                                    ","International Journal of Communication Systems (Print)","B1",2008
"1304-2386","ENGENHARIAS IV                                    ","International Journal of Computational Intelligence","B5",2008
"0973-1873","ENGENHARIAS IV                                    ","International Journal of Computational Intelligence Research","B5",2008
"0952-8091","ENGENHARIAS IV                                    ","International Journal of Computer Applications in Technology","B3",2008
"1861-6410","ENGENHARIAS IV                                    ","International Journal of Computer Assisted Radiology and Surgery (Print)","B4",2008
"0951-192X","ENGENHARIAS IV                                    ","International Journal of Computer Integrated Manufacturing (Print)","B2",2008
"1535-6698","ENGENHARIAS IV                                    ","International Journal of Computer Research","B5",2008
"0972-9038","ENGENHARIAS IV                                    ","International Journal of Computer Science & Applications","B4",2008
"1738-7906","ENGENHARIAS IV                                    ","International Journal of Computer Science and Network Security","B5",2008
"0957-4344","ENGENHARIAS IV                                    ","International Journal of Continuing Engineering Education (Cessou em 1997. Cont. ISSN 1560-4624 International Journal of Continuing Engineering Education and Life-Long Learning)","B3",2008
"0020-7179","ENGENHARIAS IV                                    ","International Journal of Control (Print)","A2",2008
"1539-3100","ENGENHARIAS IV                                    ","International Journal of Distance Education Technologies","B3",2008
"0020-7209","ENGENHARIAS IV                                    ","International Journal of Electrical Engineering Education","B1",2008
"0142-0615","ENGENHARIAS IV                                    ","International Journal of Electrical Power & Energy Systems","A2",2008
"2070-3767","ENGENHARIAS IV                                    ","International Journal of Electrical Power and Energy Systems Engineering","B3",2008
"1553-779X","ENGENHARIAS IV                                    ","International Journal of Emerging Electric Power Systems","B3",2008
"1472-8923","ENGENHARIAS IV                                    ","International Journal of Energy Technology and Policy","B3",2008
"0969-1170","ENGENHARIAS IV                                    ","International Journal of Engineering Intelligent Systems for Electrical Engineering and Communications (Cessou em 1995. Cont. ISSN 1363-2078 Engineering Intelligent Systems for Electrical Engineering and Communications)","B5",2008
"1828-6984","ENGENHARIAS IV                                    ","International Journal of Factory Automation, Robotics and Soft Computing","B5",2008
"0142-1123","ENGENHARIAS IV                                    ","International Journal of Fatigue","B1",2008
"1439-9776","ENGENHARIAS IV                                    ","International Journal of Fluid Power","B5",2008
"0169-2070","ENGENHARIAS IV                                    ","International Journal of Forecasting","B1",2008
"1562-2479","ENGENHARIAS IV                                    ","International Journal of Fuzzy Systems","B5",2008
"0308-1079","ENGENHARIAS IV                                    ","International Journal of General Systems","B2",2008
"0954-7118","ENGENHARIAS IV                                    ","International Journal of Global Energy Issues","B3",2008
"0017-9310","ENGENHARIAS IV                                    ","International Journal of Heat and Mass Transfer","A2",2008
"1751-6528","ENGENHARIAS IV                                    ","International Journal of High Performance Systems Architecture (Print)","B3",2008
"1448-5869","ENGENHARIAS IV                                    ","International Journal of Hybrid Intelligent Systems","B3",2008
"0899-9457","ENGENHARIAS IV                                    ","International Journal of Imaging Systems and Technology (Print)","B1",2008
"1550-1876","ENGENHARIAS IV                                    ","International Journal of Information and Communication Technology Education","B3",2008
"0195-9271","ENGENHARIAS IV                                    ","International Journal of Infrared and Millimeter Waves","A2",2008
"1913-133X","ENGENHARIAS IV                                    ","International Journal of Innovations in Energy Systems and Power (IJESP)","B5",2008
"1751-648X","ENGENHARIAS IV                                    ","International Journal of Innovative Computing and Applications (Print)","B3",2008
"0884-8173","ENGENHARIAS IV                                    ","International Journal of Intelligent Systems (Print)","B2",2008
"1368-2148","ENGENHARIAS IV                                    ","International Journal of Manufacturing Technology and Management","B5",2008
"1746-6172","ENGENHARIAS IV                                    ","International Journal of Modelling, Identification and Control (Print)","B3",2008
"0129-1831","ENGENHARIAS IV                                    ","International Journal of Modern Physics C","B2",2008
"1099-1190","ENGENHARIAS IV                                    ","International Journal of Network Management (Online)","B3",2008
"1816-353X","ENGENHARIAS IV                                    ","International Journal of Network Security (Print)","B5",2008
"1470-9503","ENGENHARIAS IV                                    ","International Journal of Networking and Virtual Organisations","B5",2008
"1565-1339","ENGENHARIAS IV                                    ","International Journal of Nonlinear Sciences and Numerical Simulation","A2",2008
"0894-3370","ENGENHARIAS IV                                    ","International Journal of Numerical Modelling (Print)","A2",2008
"1861-2121","ENGENHARIAS IV                                    ","International Journal of Online Engineering","B5",2008
"1082-1910","ENGENHARIAS IV                                    ","International Journal of Operations and Quantitative Management","B5",2008
"0901-5027","ENGENHARIAS IV                                    ","International Journal of Oral and Maxillofacial Surgery","B1",2008
"0885-7458","ENGENHARIAS IV                                    ","International Journal of Parallel Programming","B2",2008
"0218-0014","ENGENHARIAS IV                                    ","International Journal of Pattern Recognition and Artificial Intelligence","B2",2008
"0378-5173","ENGENHARIAS IV                                    ","International Journal of Pharmaceutics (Print)","B1",2008
"0749-6419","ENGENHARIAS IV                                    ","International Journal of Plasticity","A2",2008
"0020-7543","ENGENHARIAS IV                                    ","International Journal of Production Research (Print)","A2",2008
"0219-7499","ENGENHARIAS IV                                    ","International Journal of Quantum Information","A2",2008
"1687-7195","ENGENHARIAS IV                                    ","International Journal of Reconfigurable Computing (Print)","B3",2008
"0143-1161","ENGENHARIAS IV                                    ","International Journal of Remote Sensing (Print)","A2",2008
"1096-4290","ENGENHARIAS IV                                    ","International Journal of RF and Microwave Computer-Aided Engineering","A2",2008
"1049-8923","ENGENHARIAS IV                                    ","International Journal of Robust and Nonlinear Control (Print)","A1",2008
"0737-2884","ENGENHARIAS IV                                    ","International Journal of Satellite Communications","A2",2008
"1542-0973","ENGENHARIAS IV                                    ","International Journal of Satellite Communications and Networking (Print)","A2",2008
"1793-351X","ENGENHARIAS IV                                    ","International Journal of Semantic Computing","B5",2008
"1473-8031","ENGENHARIAS IV                                    ","International Journal of Simulation: Systems, Science & Technology (Print)","B5",2008
"0020-7683","ENGENHARIAS IV                                    ","International Journal of Solids and Structures","B1",2008
"0020-7721","ENGENHARIAS IV                                    ","International Journal of Systems Science","A2",2008
"0219-6913","ENGENHARIAS IV                                    ","International Journal of Wavelets, Mulltiresolution and Information Processing","A2",2008
"1477-8394","ENGENHARIAS IV                                    ","International Journal of Web Based Communities (Print)","B5",2008
"1744-0084","ENGENHARIAS IV                                    ","International Journal of Web Information Systems (Print)","B5",2008
"1068-9605","ENGENHARIAS IV                                    ","International Journal of Wireless Information Networks","B3",2008
"0020-8132","ENGENHARIAS IV                                    ","International Nursing Review (1954)","B2",2008
"0969-6016","ENGENHARIAS IV                                    ","International Transactions in Operational Research","B4",2008
"1068-2767","ENGENHARIAS IV                                    ","Inverse Problems in Engineering (Cessou em 2003. Cont. ISSN 1741-5977 Inverse Problems in Science & Engineering (Print))","B2",2008
"1741-5977","ENGENHARIAS IV                                    ","Inverse Problems in Science & Engineering (Print)","B2",2008
"0874-5161","ENGENHARIAS IV                                    ","Investigação Operacional","B5",2008
"0019-0578","ENGENHARIAS IV                                    ","ISA Transactions","A2",2008
"0915-1559","ENGENHARIAS IV                                    ","ISIJ International","B1",2008
"0959-3020","ENGENHARIAS IV                                    ","Isokinetics and Exercise Science","B1",2008
"0924-2716","ENGENHARIAS IV                                    ","ISPRS Journal of Photogrammetry and Remote Sensing","B1",2008
"1547-5840","ENGENHARIAS IV                                    ","Issues in Informing Science & Information Technology","B5",2008
"1521-6543","ENGENHARIAS IV                                    ","IUBMB Life (London. Print)","B2",2008
"1460-7425","ENGENHARIAS IV                                    ","JASSS (Guildford)","B3",2008
"1807-1953","ENGENHARIAS IV                                    ","JICS. Journal of Integrated Circuits and Systems (Ed. Português)","B1",2008
"0268-3962","ENGENHARIAS IV                                    ","JIT. Journal of Information Technology (Print)","B1",2008
"1517-5308","ENGENHARIAS IV                                    ","Jornal Brasileiro de Fonoaudiologia","B5",2008
"1516-7569","ENGENHARIAS IV                                    ","Jornal Brasileiro de Ortodontia & Ortopedia Facial","B5",2008
"1806-3713","ENGENHARIAS IV                                    ","Jornal Brasileiro de Pneumologia (Impresso)","B5",2008
"1155-4339","ENGENHARIAS IV                                    ","Journal de Physique. IV (Cessou em 2006. Cont. ISSN 1951-6355 The European Physical Journal. Special Topics)","B2",2008
"1269-6935","ENGENHARIAS IV                                    ","Journal Européen des Systèmes Automatisés","B5",2008
"1343-0130","ENGENHARIAS IV                                    ","Journal of Advanced Computational Intelligence","B5",2008
"0021-8561","ENGENHARIAS IV                                    ","Journal of Agricultural and Food Chemistry","B1",2008
"0021-8669","ENGENHARIAS IV                                    ","Journal of Aircraft (Print)","B1",2008
"0196-6774","ENGENHARIAS IV                                    ","Journal of Algorithms (Print)","B1",2008
"0925-8388","ENGENHARIAS IV                                    ","Journal of Alloys and Compounds","B1",2008
"1722-6899","ENGENHARIAS IV                                    ","Journal of Applied Biomaterials & Biomechanics (Testo stampato)","B5",2008
"1065-8483","ENGENHARIAS IV                                    ","Journal of Applied Biomechanics","A2",2008
"1598-5865","ENGENHARIAS IV                                    ","Journal of Applied Mathematics and Computing. International Journal","B3",2008
"1678-7757","ENGENHARIAS IV                                    ","Journal of Applied Oral Science (Impresso)","B4",2008
"0021-8979","ENGENHARIAS IV                                    ","Journal of Applied Physics","B1",2008
"8750-7587","ENGENHARIAS IV                                    ","Journal of Applied Physiology (1985)","B1",2008
"0021-8995","ENGENHARIAS IV                                    ","Journal of Applied Polymer Science (Print)","B1",2008
"0021-9002","ENGENHARIAS IV                                    ","Journal of Applied Probability","B2",2008
"0021-9037","ENGENHARIAS IV                                    ","Journal of Applied Spectroscopy","B5",2008
"1546-962X","ENGENHARIAS IV                                    ","Journal of ASTM International (Online)","B5",2008
"1364-6826","ENGENHARIAS IV                                    ","Journal of Atmospheric and Solar-Terrestrial Physics","B1",2008
"0218-3390","ENGENHARIAS IV                                    ","Journal of Biological Systems","B2",2008
"0885-3282","ENGENHARIAS IV                                    ","Journal of Biomaterials Applications","A2",2008
"0920-5063","ENGENHARIAS IV                                    ","Journal of Biomaterials Science. Polymer ed. (Print)","A1",2008
"0021-9290","ENGENHARIAS IV                                    ","Journal of Biomechanics","A1",2008
"1083-3668","ENGENHARIAS IV                                    ","Journal of Biomedical Optics","A1",2008
"0021-9320","ENGENHARIAS IV                                    ","Journal of Biosocial Science (Print)","B1",2008
"0168-1656","ENGENHARIAS IV                                    ","Journal of Biotechnology","B1",2008
"0884-0431","ENGENHARIAS IV                                    ","Journal of Bone and Mineral Research","B1",2008
"0732-8303","ENGENHARIAS IV                                    ","Journal of Carbohydrate Chemistry","B2",2008
"1557-5969","ENGENHARIAS IV                                    ","Journal of Cellular Automata","A2",2008
"0218-1266","ENGENHARIAS IV                                    ","Journal of Circuits, Systems, and Computers","B1",2008
"0363-8855","ENGENHARIAS IV                                    ","Journal of Clinical Engineering","B4",2008
"0895-4356","ENGENHARIAS IV                                    ","Journal of Clinical Epidemiology","B1",2008
"1044-5471","ENGENHARIAS IV                                    ","Journal of Clinical Laser Medicine & Surgery (Cessou em 2004. Cont. ISSN 1549-5418 Photomedicine and Laser Surgery)","B3",2008
"1387-1307","ENGENHARIAS IV                                    ","Journal of Clinical Monitoring and Computing","B4",2008
"0749-0208","ENGENHARIAS IV                                    ","Journal of Coastal Research","B2",2008
"0021-9797","ENGENHARIAS IV                                    ","Journal of Colloid and Interface Science (Print)","B1",2008
"1980-6604","ENGENHARIAS IV                                    ","Journal of Communication and Information Systems (Online)","B1",2008
"1229-2370","ENGENHARIAS IV                                    ","Journal of Communications and Networks (Seoul. Print)","B1",2008
"0377-0427","ENGENHARIAS IV                                    ","Journal of Computational and Applied Mathematics","B1",2008
"1061-8600","ENGENHARIAS IV                                    ","Journal of Computational and Graphical Statistics","A1",2008
"1546-1955","ENGENHARIAS IV                                    ","Journal of Computational and Theoretical Nanoscience","B2",2008
"1472-7978","ENGENHARIAS IV                                    ","Journal of Computational Methods in Sciences and Engineering","B5",2008
"0929-5313","ENGENHARIAS IV                                    ","Journal of Computational Neuroscience","A1",2008
"0021-9991","ENGENHARIAS IV                                    ","Journal of Computational Physics (Print)","B1",2008
"1064-2307","ENGENHARIAS IV                                    ","Journal of Computer & Systems Sciences International","B1",2008
"1000-9000","ENGENHARIAS IV                                    ","Journal of Computer Science and Technology","A2",2008
"1666-6038","ENGENHARIAS IV                                    ","Journal of Computer Science and Technology (La Plata. En línea)","B5",2008
"1549-3636","ENGENHARIAS IV                                    ","Journal of Computer Sciences","B3",2008
"0143-974X","ENGENHARIAS IV                                    ","Journal of Constructional Steel Research","B1",2008
"0022-0248","ENGENHARIAS IV                                    ","Journal of Crystal Growth","B1",2008
"0022-0345","ENGENHARIAS IV                                    ","Journal of Dental Research","A1",2008
"0300-5712","ENGENHARIAS IV                                    ","Journal of Dentistry","B1",2008
"0897-1889","ENGENHARIAS IV                                    ","Journal of Digital Imaging","B2",2008
"1618-727X","ENGENHARIAS IV                                    ","Journal of Digital Imaging (Internet)","A2",2008
"0022-0434","ENGENHARIAS IV                                    ","Journal of Dynamic Systems, Measurement, and Control","A2",2008
"0304-4076","ENGENHARIAS IV                                    ","Journal of Econometrics","B1",2008
"1881-4581","ENGENHARIAS IV                                    ","Journal of Ehealth Technology and Application","B5",2008
"1582-4594","ENGENHARIAS IV                                    ","Journal of Electrical Engineering (Timisoara)","B5",2008
"0920-5071","ENGENHARIAS IV                                    ","Journal of Electromagnetic Waves and Applications (Print)","A1",2008
"1050-6411","ENGENHARIAS IV                                    ","Journal of Electromyography and Kinesiology","B2",2008
"1560-229X","ENGENHARIAS IV                                    ","Journal of Electronic Imaging (Online)","A2",2008
"1017-9909","ENGENHARIAS IV                                    ","Journal of Electronic Imaging (Print)","A2",2008
"0361-5235","ENGENHARIAS IV                                    ","Journal of Electronic Materials","A1",2008
"0923-8174","ENGENHARIAS IV                                    ","Journal of Electronic Testing","B1",2008
"0304-3886","ENGENHARIAS IV                                    ","Journal of Electrostatics","A1",2008
"0099-2399","ENGENHARIAS IV                                    ","Journal of Endodontics","B1",2008
"0195-0738","ENGENHARIAS IV                                    ","Journal of Energy Resources Technology","B2",2008
"1093-4529","ENGENHARIAS IV                                    ","Journal of Environmental Science and Health. Part A, Toxic Hazardous Substances and Environmental Engineering","B2",2008
"1676-2649","ENGENHARIAS IV                                    ","Journal of Epilepsy and Clinical Neurophysiology (Impresso)","B4",2008
"0737-0806","ENGENHARIAS IV                                    ","Journal of Equine Veterinary Science (Print)","B2",2008
"0378-8741","ENGENHARIAS IV                                    ","Journal of Ethnopharmacology","B1",2008
"1356-1294","ENGENHARIAS IV                                    ","Journal of Evaluation in Clinical Practice (Print)","B1",2008
"0022-0949","ENGENHARIAS IV                                    ","Journal of Experimental Biology","B1",2008
"1932-5223","ENGENHARIAS IV                                    ","Journal of Experimental Zoology. Part A, Ecological Genetics and Physiology","B1",2008
"1053-0509","ENGENHARIAS IV                                    ","Journal of Fluorescence","B1",2008
"0148-0227","ENGENHARIAS IV                                    ","Journal of Geophysical Research","A2",2008
"0925-5001","ENGENHARIAS IV                                    ","Journal of Global Optimization","B1",2008
"1570-7873","ENGENHARIAS IV                                    ","Journal of Grid Computing","B5",2008
"1606-0997","ENGENHARIAS IV                                    ","Journal of Health, Population and Nutrition","B2",2008
"1381-1231","ENGENHARIAS IV                                    ","Journal of Heuristics","B2",2008
"0926-6801","ENGENHARIAS IV                                    ","Journal of High Speed Networks","B1",2008
"0162-0134","ENGENHARIAS IV                                    ","Journal of Inorganic Biochemistry","B1",2008
"1748-0221","ENGENHARIAS IV                                    ","Journal of Instrumentation","B2",2008
"1092-0617","ENGENHARIAS IV                                    ","Journal of Integrated Design & Process Science","B3",2008
